,title,published
2494,Photoactivation of silicon rhodamines via a light-induced protonation,10.1038/s41467-019-12480-3
2495,Energy landscapes reveal agonist’s control of GPCR activation via microswitches,10.1021/acs.biochem.9b00842
2497,Single-organelle quantification reveals the stoichiometric and structural variability of carboxysomes dependent on the environment,10.1105/tpc.18.00787
2498,Fat SIRAH: Coarse-grained phospholipids to explore membrane-protein dynamics.,10.1021/acs.jctc.9b00435
2500,DNA sequence is a major determinant of tetrasome dynamics,10.1016/j.bpj.2019.07.055
2501,"Influence of nanopillar arrays on fibroblast motility, adhesion and migration mechanisms",10.1002/smll.201902514
2505,High-speed motility originates from cooperatively pushing and pulling flagella bundles in bilophotrichous bacteria,10.7554/eLife.47551
2511,Differential local stability governs the metamorphic fold-switch of bacterial virulence factor RfaH,10.1016/j.bpj.2019.11.014
2514,"A Network of Phosphatidylinositol 4,5-bisphosphate Binding Sites Regulate Gating of the Ca2+-activated Cl- Channel ANO1 (TMEM16A)",10.1073/pnas.1904012116
2515,Protein structure prediction and design in a biologically-realistic implicit membrane,10.1016/j.bpj.2020.03.006
2516,Active cargo positioning in antiparallel transport networks,10.1073/pnas.1900416116
2517,Shake-it-off: A simple ultrasonic cryo-EM specimen preparation device,10.1107/S2059798319014372
2520,Histone Tail Dynamics in Partially Disassembled Nucleosomes During Chromatin Remodeling,10.3389/fmolb.2019.00133
2524,Nonreciprocal and Conditional Cooperativity Directs the Pioneer Activity of Pluripotency Transcription Factors,10.1016/j.celrep.2019.07.103
2525,Ultrafast Structural Changes Decomposed from Serial Crystallographic Data,10.1021/acs.jpclett.9b02375
2527,Nucleosomal DNA dynamics mediate Oct4 pioneer factor binding,10.1016/j.bpj.2019.12.038
2528,ADAPTS: Automated Deconvolution Augmentation of Profiles for Tissue Specific cells,10.1371/journal.pone.0224693
2529,Mesoscale liquid model of chromatin recapitulates large-scale organization of eukaryotic cell nuclei.,10.1016/j.bpj.2019.09.013
2531,Geometric state-space of protein-induced spontaneous curvature on helicoidal ramps in organelle membranes,10.1098/rsif.2019.0354
2533,A biophysical model uncovers the size distribution of migrating cell clusters across cancer types,10.1158/0008-5472.CAN-19-1726
2535,Direct visualization of human myosin II force generation using DNA origami-based thick filaments,10.1038/s42003-019-0683-0
2536,Non-Uniformity of Projection Distributions Attenuates Resolution in Cryo-EM,10.1016/j.pbiomolbio.2019.09.002
2537,A structural model of the human serotonin transporter in an outward-occluded state,10.1371/journal.pone.0217377
2539,Myosin-II mediated traction forces evoke localized Piezo1 Ca2+ flickers,10.1016/j.bpj.2018.11.2049
2540,Uncovering the Binding Mode of γ-Secretase Inhibitors,10.1021/acschemneuro.9b00272
2542,Active poroelastic Two-Phase Model for the Motion of Physarum Microplasmodia,10.1371/journal.pone.0217447
2545,Electron cryomicroscopy observation of acyl carrier protein translocation in type I fungal fatty acid synthase,10.1038/s41598-019-49261-3
2548,Unveiling the multi-step solubilization mechanism of single vesicles by detergents.,10.1038/s41598-019-49210-0
2549,Frustration and Fidelity in Influenza Genome Assembly,10.1098/rsif.2019.0411
2551,Fluorescent Sp3 Defect-Tailored Carbon Nanotubes Enable NIR-II Single Particle Imaging in Live Brain Slices at Ultra-Low Excitation Doses,10.1038/s41598-020-62201-w
2552,Role of coiled-coil registry shifts in activation of human Bicaudal D2 for dynein recruitment upon cargo-binding,10.1021/acs.jpclett.9b01865
2556,ADAPTS: Automated Deconvolution Augmentation of Profiles for Tissue Specific cells,10.1371/journal.pone.0224693
2564,Size and structure of the sequence space of repeat proteins,10.1371/journal.pcbi.1007282
2565,The axonal actin-spectrin lattice acts as a tension buffering shock absorber,10.7554/eLife.51772
2566,Helix formation during the coupled binding and folding of intrinsically disordered proteins monitored by synchrotron-radiation circular dichroism spectroscopy,10.1016/j.bpj.2019.07.014
2568,Non-Uniformity of Projection Distributions Attenuates Resolution in Cryo-EM,10.1016/j.pbiomolbio.2019.09.002
2569,Exploring the Mechanism of Olfactory Recognition at the Initial Stage by Modeling the Emission Spectrum of Electron Transfer,10.1371/journal.pone.0217665
2572,Cell-sized confinement controls generation and stability of a protein wave for spatiotemporal regulation in cells,10.7554/eLife.44591
2574,Allosteric modulation of local reactivity in DNA origami,10.1093/nar/gkaa080
2576,High-resolution and high-accuracy topographic and transcriptional maps of the nucleosome barrier,10.7554/eLife.48281
2578,POLARIS: path of least action analysis on energy landscapes,10.1021/acs.jcim.9b01108
2579,Probing Allosteric Coupling of a Constitutively Open Mutant of the Ion Channel KcsA using Solid State NMR,10.1073/pnas.1908828117
2580,Fluorescence biosensor for real-time interaction dynamics of host proteins with HIV-1 capsid tubes,10.1021/acsami.9b08521
2581,Atomistic basis of opening and conduction in mammalian inward rectifier potassium (Kir2.2) channels,10.1085/jgp.201912422
2582,Leader cells in collective chemotaxis: optimality and tradeoffs,10.1103/PhysRevE.100.032417
2583,Effect of helical kink in antimicrobial peptides on membrane pore formation,10.7554/eLife.47946
2584,The contribution of the ankyrin repeat domain of TRPV1 as a thermal module,10.1016/j.bpj.2019.10.041
2586,High-throughput microfluidic micropipette aspiration device to probe time-scale dependent nuclear mechanics in intact cells,10.1039/C9LC00444K
2587,Single molecule analysis of effects of non-canonical guide RNAs and specificity-enhancing mutations on Cas9-induced DNA unwinding,10.1093/nar/gkz1058
2590,"Identifying dynamic, partially occupied residues using anomalous scattering",10.1107/S2059798319014475
2594,Mitochondrial morphology provides a mechanism for energy buffering at synapses,10.1038/s41598-019-54159-1
2597,Probing Allosteric Coupling of a Constitutively Open Mutant of the Ion Channel KcsA using Solid State NMR,10.1073/pnas.1908828117
2599,MolMeDB: Molecules on Membranes Database,10.1093/database/baz078
2600,Nanoscale dynamics of cholesterol in the cell membrane,10.1074/jbc.RA119.009683
2603,Plasticity of cell migration resulting from mechanochemical coupling,10.7554/eLife.48478
2605,Directional stepping model for yeast dynein: Longitudinal- and side- step distributions,10.1016/j.bpj.2019.09.043
2608,Quantitative studies of an RNA duplex electrostatics by ion counting,10.1016/j.bpj.2019.08.007
2610,Dynamic vessel adaptation in synthetic arteriovenous networks,10.1016/j.jtbi.2019.109989
2611,Directional stepping model for yeast dynein: Longitudinal- and side- step distributions,10.1016/j.bpj.2019.09.043
2613,Structural characterization of tau in fuzzy tau:tubulin complexes,10.1016/j.str.2020.01.004
2614,Detecting and controlling dye effects in single-virus fusion experiments,10.1016/j.bpj.2019.06.022
2617,DNA-segment-capture model for loop extrusion by structural maintenance of chromosome (SMC) protein complexes,10.1093/nar/gkz497
2618,Precisely control mitochondria with light to manipulate cell fate decision,10.1016/j.bpj.2019.06.038
2620,Second Harmonic Generation Spectroscopy of Membrane Probe Dynamics in Gram-Positive Bacteria,10.1016/j.bpj.2019.09.014
2621,Time-Resolved Integrative Optical Imaging of Diffusion during Spreading Depression,10.1016/j.bpj.2019.08.031
2622,Aggregation dynamics of charged peptides in water: effect of salt concentration,10.1063/1.5100890
2623,Mechanosensitive junction remodelling promotes robust epithelial morphogenesis,10.1016/j.bpj.2019.09.027
2624,Upgraded molecular models of the human KCNQ1 potassium channel,10.1371/journal.pone.0220415
2625,Computational design of a modular protein sense/response system,10.1126/science.aax8780
2628,Using a continuum model to decipher the mechanics of embryonic tissue spreading from time-lapse image sequences: An approximate Bayesian computation approach,10.1371/journal.pone.0218021
2629,Molecular mechanism of TRPV2 channel modulation by cannabidiol,10.7554/eLife.48792
2630,Controlling Organization and Forces in Active Matter Through Optically-Defined Boundaries,10.1038/s41586-019-1447-1
2633,High-throughput microfluidic characterization of erythrocyte shape and mechanical variability,10.1016/j.bpj.2019.05.022
2634,DNA sequence is a major determinant of tetrasome dynamics,10.1016/j.bpj.2019.07.055
2637,A possible role for epigenetic feedback regulation in the dynamics of the Epithelial-Mesenchymal Transition (EMT),10.1088/1478-3975/ab34df
2638,High-throughput smFRET analysis of freely diffusing nucleic acid molecules and associated proteins,10.1016/j.ymeth.2019.07.021
2640,Resolving kinesin stepping: one head at a time,10.26508/lsa.201900456
2641,A possible role for epigenetic feedback regulation in the dynamics of the Epithelial-Mesenchymal Transition (EMT),10.1088/1478-3975/ab34df
2643,Dynamical decoration of stabilized-microtubules by tau-proteins,10.1038/s41598-019-48790-1
2644,Exploring Conformational Transitions and Free Energy Profiles of Proton Coupled Oligopeptide Transporters,10.1021/acs.jctc.9b00524
2646,Error-speed correlations in biopolymer synthesis,10.1103/PhysRevLett.123.038101
2648,Precisely control mitochondria with light to manipulate cell fate decision,10.1016/j.bpj.2019.06.038
2650,The development of cooperative channels explains the maturation of hair cell’s mechanotransduction,10.1016/j.bpj.2019.08.042
2652,Implicit micelle model for membrane proteins using super-ellipsoid approximation,10.1021/acs.jctc.9b00783
2657,Allosteric modulation of local reactivity in DNA origami,10.1093/nar/gkaa080
2658,A possible role for epigenetic feedback regulation in the dynamics of the Epithelial-Mesenchymal Transition (EMT),10.1088/1478-3975/ab34df
2663,Hybrid refinement of heterogeneous conformational ensembles using spectroscopic data,10.1021/acs.jpclett.9b01407
2664,Geometric principles of second messenger dynamics in dendritic spines,10.1038/s41598-019-48028-0
2665,Occupancy distributions of membrane proteins in heterogeneous liposome populations,10.1016/j.bbamem.2019.183033
2666,OptiJ: Open-source optical projection tomography of large organ samples,10.1038/s41598-019-52065-0
2667,Toward computational design of protein crystals with improved resolution,10.1107/S2059798319013226
2670,The conical shape of DIM lipids promotes Mycobacterium tuberculosis infection of macrophages,10.1073/pnas.1910368116
2671,Axial variation of deoxyhemoglobin density as a source of BOLD low-frequency time lag structure.,10.1371/journal.pone.0222787
2673,Spontaneous Self-assembly of Amyloid β (1-40) into Dimers,10.1039/C9NA00380K
2674,Comparative Analysis of Electrostatic Models for Ligand Docking,10.3389/fmolb.2019.00052
2675,Axial variation of deoxyhemoglobin density as a source of BOLD low-frequency time lag structure.,10.1371/journal.pone.0222787
2676,Electric-induced reversal of morphogenesis in Hydra,10.1016/j.bpj.2019.09.007
2677,Biophysical principles of choanoflagellate self-organization,10.1073/pnas.1909447117
2679,Elucidating the Influence of Linker Histone Isoforms on Chromatosome Dynamics and Energetics,10.1093/nar/gkaa121
2680,"Modified Potential Functions Result in Enhanced Predictions of a Protein Complex by All-Atom MD Simulations, Confirming a Step-wise Association Process for Native PPIs",10.1021/acs.jctc.9b00195
2684,Allosteric Motions of the CRISPR-Cas9 HNH Nuclease Probed by NMR and Molecular Dynamics,10.1021/jacs.9b10521
2685,Live cell single molecule tracking and localization microscopy of bioorthogonally labeled plasma membrane proteins,10.1039/C9NR08594G
2686,Mathematical models incorporating a multi-stage cell cycle replicate normally-hidden innate synchronisation in cell proliferation,10.1098/rsif.2019.0382
2689,Kindlin Assists Talin to Promote Integrin Activation,10.1016/j.bpj.2020.02.023
2690,Fine-grained simulations of the microenvironment of vascularized tumours,10.1038/s41598-019-48252-8
2691,Stochastic Yield Catastrophes and Robustness in Self-Assembly,10.7554/eLife.51020
2693,Tunability of DNA polymerase stability during eukaryotic DNA replication,10.1016/j.molcel.2019.10.005
2694,Kinetic mechanisms of fast glutamate sensing by fluorescent protein probes,10.1016/j.bpj.2019.11.006
2696,Magainin 2 and PGLa in Bacterial Membrane Mimics I: Peptide-Peptide and Lipid-Peptide Interactions,10.1016/j.bpj.2019.10.022
2698,Modelling bacterial twitching in fluid flows: a CFD-DEM approach,10.1038/s41598-019-51101-3
2700,Zebrafish spinal cord repair is accompanied by transient tissue stiffening,10.1016/j.bpj.2019.10.044
2704,An intact keratin network is crucial for mechanical integrity and barrier function in keratinocyte cell sheets,10.1007/s00018-019-03424-7
2705,Alternative transcription cycle for bacterial RNA polymerase,10.1038/s41467-019-14208-9
2706,Design of biochemical pattern forming systems from minimal motifs,10.7554/eLife.48646
2707,Zebrafish spinal cord repair is accompanied by transient tissue stiffening,10.1016/j.bpj.2019.10.044
2711,Environmental Triggers of lrgA Expression in Streptococcus mutans,10.3389/fmicb.2020.00018
2712,Dependence of fluorodeoxyglucose (FDG) uptake on cell cycle and dry mass: a single-cell study using a multi-modal radiography platform,10.1038/s41598-020-59515-0
2714,A Refined Open State of the Glycine Receptor Obtained Via Molecular Dynamics Simulations,10.1016/j.str.2019.10.019
2715,Cellular heterogeneity in pressure and growth emerges from tissue topology and geometry,10.1016/j.cub.2020.02.027
2716,The development of cooperative channels explains the maturation of hair cell’s mechanotransduction,10.1016/j.bpj.2019.08.042
2717,Mechanical properties of plasma membrane vesicles correlate with lipid order and viscosity and depend on cell density,10.1038/s42003-019-0583-3
2719,Carbohydrate and PepO control bimodality in competence development by Streptococcus mutans,10.1111/mmi.14367
2720,Phosphorylation of Ser111 in Rab8a modulates Rabin8 dependent activation by perturbation of side chain interaction networks,10.1021/acs.biochem.9b00516
2722,Chromatin nanoscale compaction in live cells visualized by acceptor-donor ratio corrected FRET between DNA dyes,10.1002/jbio.201900164
2726,Magnetic-alignment of polymer macro-nanodiscs enable residual dipolar couplings based high-resolution structural studies by NMR,10.1002/anie.201907655
2727,Preferential phosphatidylinositol 5-phosphate binding contributes to a destabilization of the VHS domain structure of Tom1,10.1038/s41598-019-47386-z
2728,Geometrical constraints greatly hinder formin mDia1 activity,10.1021/acs.nanolett.9b02241
2730,A mechanical model reveals that non-axisymmetric buckling lowers the energy barrier associated with membrane neck constriction,10.1039/C9SM01494B
2731,Intrinsically disordered nuclear pore proteins show ideal-polymer morphologies and dynamics,10.1103/PhysRevE.101.022420
2735,Vimentin intermediate filaments undergo irreversible conformational changes during cyclic loading,10.1021/acs.nanolett.9b02972
2738,Comparison of Rosetta flexible-backbone computational protein design methods on binding interactions,10.1002/prot.25790
2741,Mechanics of allostery: contrasting the induced fit and population shift scenarios,10.1016/j.bpj.2019.10.002
2743,Symmetry breaking transition towards directional locomotion in Physarum microplasmodia,10.1088/1361-6463/ab3ec8
2744,Terasaki Spiral Ramps and Intracellular Diffusion,10.1088/1478-3975/ab4080
2746,"Large-scale, dynamin-like motions of the human guanylate binding protein 1 revealed by multi-resolution simulations",10.1371/journal.pcbi.1007193
2747,Prospects for transcranial temporal interference stimulation in humans: a computational study,10.1016/j.neuroimage.2019.116124
2751,Lateral Subunit Coupling Determines Intermediate Filament Mechanics,10.1103/PhysRevLett.123.188102
2756,Using a continuum model to decipher the mechanics of embryonic tissue spreading from time-lapse image sequences: An approximate Bayesian computation approach,10.1371/journal.pone.0218021
2760,Effect of Alpha-Lactalbumin and Lactoferrin Oleic Acid Complexes on Chromatin Structural Organization,10.1016/j.bbrc.2019.09.116
2769,Dissection of ligand-CDK8/CycC unbinding free energy barriers and kinetics by molecular simulations,10.1021/acs.jctc.9b01153
2770,Criticality of plasma membrane lipids reflects activation state of macrophage cells,10.1098/rsif.2019.0803
2771,Exploring the role of the various methionine residues in the Escherichia coli CusB adapter protein,10.1371/journal.pone.0219337
2773,PEGylated surfaces for the study of DNA-protein interactions by atomic force microscopy,10.1039/C9NR07104K
2775,The Ca2+ Permeation Mechanism of the Ryanodine Receptor Revealed by a Multi-Site Ion Model,10.1038/s41467-020-14573-w
2776,Molecular dynamics simulations and linear response theories jointly describe biphasic responses of myoglobin relaxation and reveal evolutionarily conserved frequent communicators,10.2142/biophysico.16.0_473
2778,Axial variation of deoxyhemoglobin density as a source of BOLD low-frequency time lag structure.,10.1371/journal.pone.0222787
2781,High-throughput smFRET analysis of freely diffusing nucleic acid molecules and associated proteins,10.1016/j.ymeth.2019.07.021
2783,DNA-loop extruding condensin complexes can traverse one another,10.1038/s41586-020-2067-5
2785,Calcium buffers and L-type calcium channels as modulators of cardiac subcellular alternans,10.1016/j.cnsns.2020.105181
2786,"Coevolutive, Evolutive and Stochastic Information in Protein-Protein Interactions",10.1016/j.csbj.2019.10.005
2788,Variable Mutations at the p53-R273 Oncogeic Hotspot Position Leads to Altered Properties,10.1016/j.bpj.2019.12.015
2789,Processivity and Velocity for Motors Stepping on Periodic Tracks,10.1016/j.bpj.2020.01.047
2790,Transcription reinitiation by recycling RNA polymerase that diffuses on DNA after releasing terminated RNA,10.1038/s41467-019-14200-3
2796,An analytical theory of balanced cellular growth,10.1038/s41467-020-14751-w
2797,FISIK: Framework for the Inference of in Situ Interaction Kinetics from single-molecule imaging data,10.1016/j.bpj.2019.07.050
2803,Polymer-like model to study the dynamics of dynamin filaments on deformable membrane tubes,10.1016/j.bpj.2019.09.042
2804,Theory of active chromatin remodeling,10.1103/PhysRevLett.123.208102
2805,Cellular heterogeneity in pressure and growth emerges from tissue topology and geometry,10.1016/j.cub.2020.02.027
2807,Wide-field time-gated SPAD imager for phasor-based FLIM applications,10.1088/2050-6120/ab6ed7
2808,Power series method for solving TASEP-based models of mRNA translation,10.1088/1478-3975/ab57a0
2813,Shortening injection matrix for serial crystallography,10.1038/s41598-019-56135-1
2814,Molecular dynamics simulations and linear response theories jointly describe biphasic responses of myoglobin relaxation and reveal evolutionarily conserved frequent communicators,10.2142/biophysico.16.0_473
2815,Non-ohmic tissue conduction in cardiac electrophysiology: upscaling the non-linear voltage-dependent conductance of gap junctions,10.1371/journal.pcbi.1007232
2817,CANDOCK: Chemical atomic network based hierarchical flexible docking algorithm using generalized statistical potentials,10.1021/acs.jcim.9b00686
2821,Metal bridge in S4 segment supports helix transition in Shaker channel,10.1016/j.bpj.2019.08.035
2822,Bayesian-Maximum-Entropy reweighting of IDPs ensembles based on NMR chemical shifts,10.3390/e21090898
2823,Mechanism of μ-Opioid Receptor-Magnesium Interaction and Positive Allosteric Modulation.,10.1016/j.bpj.2019.10.007
2825,Calcium buffers and L-type calcium channels as modulators of cardiac subcellular alternans,10.1016/j.cnsns.2020.105181
2826,Human POT1 Unfolds G-Quadruplexes by Conformational Selection,10.1093/nar/gkaa202
2829,Thermal and Chemical Unfolding of a recombinant monoclonal IgG1 antibody: Application of the Multi-State Zimm-Bragg Theory,10.1016/j.bpj.2019.12.037
2830,NMR reveals light-induced changes in the dynamics of a photoswitchable fluorescent protein,10.1016/j.bpj.2019.10.035
2833,Free-energy-based framework for early forecasting of stem cell differentiation,10.1098/rsif.2019.0571
2834,Model order reduction for left ventricular mechanics via congruency training,10.1371/journal.pone.0219876
2835,"Comparing the performance of mScarlet-I, mRuby3, and mCherry as FRET acceptors for mNeonGreen",10.1371/journal.pone.0219886
2836,Imaging live bacteria at the nanoscale: comparison of immobilisation strategies,10.1039/C9AN01185D
2837,Area compressibility moduli of the monolayer leaflets of asymmetric bilayers from simulations,10.1016/j.bpj.2019.08.016
2840,"Comparing the performance of mScarlet-I, mRuby3, and mCherry as FRET acceptors for mNeonGreen",10.1371/journal.pone.0219886
2842,"Loop-closure Kinetics Reveal a Stable, Right-handed DNA Intermediate in Cre Recombination",10.1093/nar/gkaa153
2843,Spatio-temporal correlations between catastrophe events in a microtubule bundle: a computational study,10.1007/s00249-020-01427-y
2844,Decoding WW Domain Tandem-mediated Target Recognitions in Tissue Growth and Cell Polarity,10.7554/eLife.49439
2845,Magnetic Resonance measurements of sub-cellular membrane structures in live and fixed neural tissue,10.7554/eLife.51101
2846,Extracting molecular insights from conformational ensembles using Machine Learning,10.1016/j.bpj.2019.12.016
2848,How heterogeneity in glucokinase and gap junction coupling determines the islet electrical response,10.1016/j.bpj.2019.10.037
2850,"Interaction of a sarcolipin pentamer and monomer with the sarcoplasmic reticulum calcium pump, SERCA",10.1016/j.bpj.2019.11.3385
2851,Mathematical models incorporating a multi-stage cell cycle replicate normally-hidden inherent synchronisation in cell proliferation,10.1098/rsif.2019.0382
2852,Spatial structure arising from chase-escape interactions with crowding,10.1038/s41598-019-51565-3
2853,"Loop-closure Kinetics Reveal a Stable, Right-handed DNA Intermediate in Cre Recombination",10.1093/nar/gkaa153
2858,Axial variation of deoxyhemoglobin density as a source of BOLD low-frequency time lag structure.,10.1371/journal.pone.0222787
2859,Multiple Binding Configurations of Fis Protein Pairs on DNA: Facilitated Dissociation versus Cooperative Dissociation,10.1021/jacs.9b08287
2860,"Model Plasma Membrane exhibits a Microemulsion in both Leaves providing a Foundation for \""Rafts\""",10.1016/j.bpj.2020.01.004
2861,The costs of close contact: Visualizing the energy landscape of cell contacts at the nanoscale,10.1016/j.bpj.2020.01.019
2863,Force-dependent facilitated dissociation can generate protein-DNA catch bonds,10.1016/j.bpj.2019.07.044
2865,Revealing the Assembly of Filamentous Proteins with Scanning Transmission Electron Microscopy,10.1371/journal.pone.0226277
2867,Bioelectrical signaling via domain wall migration,10.1038/s41567-019-0765-4
2868,Model order reduction for left ventricular mechanics via congruency training,10.1371/journal.pone.0219876
2869,Compaction dynamics during progenitor cell self-assembly reveal granular mechanics,10.1016/j.matt.2020.02.016
2872,Transcription reinitiation by recycling RNA polymerase that diffuses on DNA after releasing terminated RNA,10.1038/s41467-019-14200-3
2877,Ultrafast Structural Changes Decomposed from Serial Crystallographic Data,10.1021/acs.jpclett.9b02375
2878,Light-sheet engineering using the Field Synthesis theorem,10.1088/2515-7647/ab5028
2879,Liquid-liquid phase separation and fibrillization of tau are independent processes with overlapping conditions,10.1021/acschemneuro.9b00627
2881,"High-performance analysis of biomolecular containers to measure small-molecule transport, transbilayer lipid diffusion, and protein cavities",10.1021/acs.jcim.9b00324
2883,Light-sheet engineering using the Field Synthesis theorem,10.1088/2515-7647/ab5028
2885,An atomistic perspective on ADCC quenching by core-fucosylation of IgG1 Fc N-glycans from enhanced sampling molecular dynamics,10.1093/glycob/cwz101
2886,An implicit lipid model for efficient reaction-diffusion simulations of protein binding to surfaces of arbitrary topology,10.1063/1.5120516
2890,Insights into the molecular mechanisms underlying the inhibition of acid-sensing ion channel 3 gating by Stomatin,10.1085/jgp.201912471
2891,Diffusion analysis of single particle trajectories in a Bayesian nonparametrics framework,10.1088/1478-3975/ab64b3
2892,Structures of the ATP-fueled ClpXP proteolytic machine bound to protein substrate,10.7554/eLife.52774
2896,Continuum descriptions of spatial spreading for heterogeneous cell populations: theory and experiment,10.1016/j.jtbi.2019.109997
2898,Structural basis of DNA targeting by a transposon-encoded CRISPR-Cas system,10.1038/s41586-019-1849-0
2899,Discrete Mechanical Growth Model for Plant Tissue,10.1371/journal.pone.0221059
2900,Regulation of lipid saturation without sensing membrane fluidity,10.1038/s41467-020-14528-1
2902,Structural Basis of Enhanced Facilitated Diffusion of DNA Binding Protein in Crowded Cellular Milieu,10.1016/j.bpj.2019.11.3388
2904,ER membranes exhibit phase behavior at sites of organelle contact,10.1073/pnas.1910854117
2905,The Role of a Crystallographically Unresolved Cytoplasmic Loop in Stabilizing the Bacterial Membrane Insertase YidC2,10.1038/s41598-019-51052-9
2906,"Probing protein-protein and protein-substrate interactions in the dynamic membrane-associated ternary complex of Cytochromes P450, b5, and Reductase",10.1039/C9CC05904K
