,title,published
1814,Binding From both sides: TolR and full-length OmpA bind and maintain the local structure of the E. coli cell wall,10.1016/j.str.2019.01.001
1816,Reducing RF-Induced Heating Near Implanted Leads Through High-Dielectric Capacitive Bleeding of Current (CBLOC),10.1109/TMTT.2018.2885517
1818,Modulating hinge flexibility in the APP transmembrane domain alters γ-secretase cleavage,10.1016/j.bpj.2019.04.030
1819,"Mechanistic insights from replica exchange molecular dynamics simulations into mutation induced disordered-to-ordered transition in Hahellin, a βγ-crystallin",10.1021/acs.jpcb.9b03845
1822,Limits of chromosome compaction by loop-extruding motors,10.1103/physrevx.9.031007
1823,Mechanistic investigation of mEos4b reveals a strategy to reduce track interruptions in sptPALM,10.1038/s41592-019-0462-3
1825,On the impact of chemo-mechanically induced phenotypic transitions in gliomas,10.3390/cancers11050716
1826,Temperature-Jump Solution X-ray Scattering Reveals Distinct Motions in a Dynamic Enzyme,10.1038/s41557-019-0329-3
1827,Self-assembly of polymer-encased lipid nanodiscs and membrane protein reconstitution,10.1021/acs.jpcb.9b03681
1830,Small GTPase patterning: How to stabilise cluster coexistence,10.1371/journal.pone.0213188
1834,Temperature-Jump Solution X-ray Scattering Reveals Distinct Motions in a Dynamic Enzyme,10.1038/s41557-019-0329-3
1837,Hierarchical multiscale simulation of DNA condensation,10.1093/nar/gkz377
1838,Entropic forces drive cellular contact guidance,10.1016/j.bpj.2019.04.003
1840,Structures of TOG1 and TOG2 From the Human Microtubule Dynamics Regulator CLASP1,10.1371/journal.pone.0219823
1841,Large Fatty Acid-derived Aβ42 oligomers Form Ring-like Assemblies,10.1063/1.5082659
1842,Deep-learning-based label-free segmentation of cell nuclei in time-lapse refractive index tomograms,10.1109/ACCESS.2019.2924255
1843,DYT1 dystonia patient-derived fibroblasts have increased deformability and susceptibility to damage by mechanical forces.,10.3389/fcell.2019.00103
1846,Integrated ligand and structure-based investigation of structural requirements for silent information regulator  activation,10.2174/1568026619666181220111059
1848,Conformational dynamics of the HIV Vif protein complex,10.1016/j.bpj.2019.03.014
1851,Integrated ligand and structure-based investigation of structural requirements for silent information regulator  activation,10.2174/1568026619666181220111059
1852,"Irregular chromatin: packing density, fiber width and occurrence of heterogeneous clusters",10.1016/j.bpj.2019.11.004
1853,Patterns of anisotropic temperature factors in bovine trypsin crystals with and without 0.5 THz irradiation,10.1038/s41598-019-55777-5
1854,Resolving Cytosolic Diffusive States in Bacteria by Single-Molecule Tracking,10.1016/j.bpj.2019.03.039
1855,Frustrated binding of biopolymer crosslinkers,10.1039/c8sm02429d
1860,A Thermodynamic Limit on the Role of Self-Propulsion in Enhanced Enzyme Diffusion,10.1016/j.bpj.2019.04.005
1862,Recycling of single-stranded DNA-binding protein by the bacterial replisome.,10.1093/nar/gkz090
1866,Temperature-Jump Solution X-ray Scattering Reveals Distinct Motions in a Dynamic Enzyme,10.1038/s41557-019-0329-3
1867,Theory of mechano-chemical patterning in biphasic biological tissues,10.1073/pnas.1813255116
1869,High-throughput microfluidic characterization of erythrocyte shape and mechanical variability,10.1016/j.bpj.2019.05.022
1870,High-throughput microfluidic characterization of erythrocyte shape and mechanical variability,10.1016/j.bpj.2019.05.022
1872,Myosin-II mediated traction forces evoke localized Piezo1 Ca2+ flickers,10.1016/j.bpj.2018.11.2049
1873,On the impact of chemo-mechanically induced phenotypic transitions in gliomas,10.3390/cancers11050716
1876,Retrieving High-Resolution Information from Disordered 2D Crystals by Single Particle Cryo-EM,10.1038/s41467-019-09661-5
1877,Realistic vOlumetric-Approach to Simulate Transcranial Electric Stimulation -- ROAST -- a fully automated open-source pipeline,10.1088/1741-2552/ab208d
1878,High-resolution structure determination of sub-100 kilodalton complexes using conventional cryo-EM,10.1038/s41467-019-08991-8
1882,Structure and dynamics of the central lipid pool and protein components of the bacterial holo-translocon,10.1016/j.bpj.2019.04.002
1883,Identification of N-linked glycans as specific mediators of neuronal uptake of acetylated α-Synuclein,10.1371/journal.pbio.3000318
1885,"Domain topology, stability, and translation speed determine mechanical force generation on the ribosome",10.1073/pnas.1813003116
1886,Atomic Level Characterisation of Millisecond-Time Scale Protein Motions through a Combined Molecular Simulations and NMR Approach,10.1039/C9SC04696H
1888,Identification of N-linked glycans as specific mediators of neuronal uptake of acetylated α-Synuclein,10.1371/journal.pbio.3000318
1889,"Modular, ultra-stable, and highly parallel protein force spectroscopy in magnetic tweezers using peptide linkers",10.1073/pnas.1901794116
1890,High-molecular-weight polymers from dietary fiber drive aggregation of particulates in the murine small intestine,10.7554/elife.40387
1891,Using the NoiSee workflow to measure signal-to-noise ratios of confocal microscopes,10.1038/s41598-018-37781-3
1893,Sustained oscillations of epithelial cell sheets,10.1016/j.bpj.2019.06.013
1895,Spontaneous driving forces give rise to protein-RNA condensates with coexisting phases and complex material properties,10.1073/pnas.1821038116
1898,Interaction specificity of clustered protocadherins inferred from sequence covariation and structural analysis,10.1073/pnas.1821063116
1899,"Porcine circovirus 2 uses a multitude of weak binding sites to interact with heparan sulfate, and the interactions do not follow the symmetry of the capsid",10.1128/jvi.02222-18
1901,Critical Role of Histone Tail Entropy in Nucleosome Unwinding,10.1063/1.5085663
1902,Modulation of tissue growth heterogeneity by responses to mechanical stress,10.1073/pnas.1815342116
1904,An RNA-binding region regulates CTCF clustering and chromatin looping,10.1016/j.molcel.2019.07.039
1905,Collective search with finite perception: transient dynamics and search efficiency,10.3389/fphy.2018.00153
1906,Guided nuclear exploration increases CTCF target search efficiency,10.1038/s41589-019-0422-3
1909,Liquid-crystal organization of liver tissue,10.7554/eLife.44860
1911,Bee and floral traits affect the characteristics of the vibrations experienced by flowers during buzz-pollination,10.1242/jeb.198176
1912,Can a flux-based mechanism explain positioning of protein clusters in a three-dimensional cell geometry?,10.1016/j.bpj.2019.06.031
1913,‘Chromatic’ Neuronal Jamming in a Primitive Brain,10.1038/s41567-020-0809-9
1915,Spectral Contrast Optical Coherence Tomography Angiography Enables Single-Scan Vessel Imaging,10.1038/s41377-018-0117-7
1916,Tonotopy of the mammalian cochlea is associated with stiffness and tension gradients of the hair cell’s tip-link complex,10.7554/eLife.43473
1917,Gibbs Free Energy of Protein-Protein Interactions Correlates with ATP Production in Cancer Cells,10.1007/s10867-019-09537-1
1918,Identification of Hydrophobic Gates by Simulation-Enabled Analysis of the Ion Channel Structural Proteome,10.1073/pnas.1902702116
1919,Integrated NMR and cryo-EM atomic-resolution structure determination of a half-megadalton enzyme complex,10.1038/s41467-019-10490-9
1920,An RNA-binding region regulates CTCF clustering and chromatin looping,10.1016/j.molcel.2019.07.039
1921,Motor properties of PilT-independent type 4 pilus retraction in gonococci,10.1128/jb.00778-18
1923,Physical Principles of Retroviral Integration in the Human Genome,10.1038/s41467-019-08333-8
1924,Impact of branching on the conformational heterogeneity of the lipopolysaccharide from Klebsiella pneumoniae: Implications for vaccine design,10.1016/j.carres.2019.02.003
1927,Substrate inhibition imposes fitness penalty at high protein stability,10.1073/pnas.1821447116
1929,Structural Modeling of Gamma-Secretase Aβn ComplexFormation and Substrate Processing,10.1021/acschemneuro.8b00725
1930,Structures of the Catalytically Activated Yeast Spliceosome Reveal the Mechanism of Branching,10.1016/j.cell.2019.02.006
1932,Upper bound on the biological effects of 50/60 Hz magnetic fields mediated by radical pairs,10.7554/elife.44179
1933,SYSTEMATIC MAPPING OF CELL WALL MECHANICS IN THE REGULATION OF CELL MORPHOGENESIS,10.1073/pnas.1820455116
1934,Evolutionary couplings detect side-chain interactions,10.7717/peerj.7280
1935,Structural Modeling of Gamma-Secretase Aβn ComplexFormation and Substrate Processing,10.1021/acschemneuro.8b00725
1936,Integrin α6β4 recognition of a linear motif of bullous pemphigoid antigen BP230 controls its recruitment to hemidesmosomes,10.1016/j.str.2019.03.016
1939,Elongated cells drive morphogenesis in a surface-wrapped finite element model of germband retraction,10.1016/j.bpj.2019.05.023
1941,Controlling Organization and Forces in Active Matter Through Optically-Defined Boundaries,10.1038/s41586-019-1447-1
1942,A unifying photocycle model for light adaptation and temporal evolution of cation conductance in Channelrhodopsin-2,10.1073/pnas.1818707116
1943,Structural basis for the inhibition of translation through eIF2α phosphorylation,10.1038/s41467-019-10606-1
1944,Determinants of cyclization-decyclization kinetics of short DNA with sticky ends,10.1093/nar/gkaa207
1946,Integrated ligand and structure-based investigation of structural requirements for silent information regulator  activation,10.2174/1568026619666181220111059
1947,Computational Correction of Spatially-Variant Optical Aberrations in 3D Single Molecule Localization Microscopy,10.1364/oe.27.012582
1950,GeTFEP: A general transfer free energy profile of transmembrane proteins,10.1002/pro.3763
1953,Namdinator - Automatic Molecular Dynamics flexible fitting of structural models into cryo-EM and crystallography experimental maps,10.1107/S2052252519007619
1954,Chronology of motor-mediated microtubule streaming,10.7554/elife.39694
1955,The interplay of structural and cellular biophysics controls clustering of multivalent molecules,10.1016/j.bpj.2019.01.001
1957,Searching the optimal folding routes of a Complex Lasso protein,10.1016/j.bpj.2019.05.025
1958,Spontaneous Resolution in Racemic Solutions of N-trifluoroacetylated α-aminoalcohols,10.1016/j.molstruc.2019.01.036
1959,The complete structure of the human TFIIH core complex,10.7554/eLife.44771
1962,Cryo-EM Structure of OSCA1.2 from Oryza sativa: Mechanical basis of hyperosmolality-gating in Plants,10.1073/pnas.1900774116
1963,Modeling membrane nanotube morphology: the role of heterogeneity in composition and material properties,10.1038/s41598-020-59221-x
1964,Combinatorial Control through Allostery,10.1021/acs.jpcb.8b12517
1965,Structural basis of recognition and destabilization of histone H2B ubiquitinated nucleosome by DOT1L histone H3 Lys79 methyltransferase,10.1101/gad.323790.118
1966,Molecular Crowding Tunes Material States of Ribonucleoprotein Condensates,10.3390/biom9020071
1967,A Bistable Mechanism Mediated by Integrins Controls Mechanotaxis of Leukocytes,10.1016/j.bpj.2019.12.013
1968,Effect of Adhesion and Substrate Elasticity on Neutrophil Extracellular Trap Formation,10.3389/fimmu.2019.02320
1973,Identifying multiple kinetic populations of DNA binding proteins in live cells using single-molecule fluorescence imaging,10.1016/j.bpj.2019.07.015
1974,Base-pair mismatch can destabilize small DNA loops through cooperative kinking,10.1103/PhysRevLett.122.218101
1977,The axonal actin-spectrin lattice acts as shock absorbers to protect neurons from stretch-induced damage,10.7554/eLife.51772
1980,Coupling water fluxes with cell wall mechanics in a multicellular model of plant development,10.1371/journal.pcbi.1007121
1983,The complete structure of the human TFIIH core complex,10.7554/eLife.44771
1984,Nanoscale mapping of DNA dynamics in live human cells,10.1186/s13059-020-02002-6
1985,Active cargo positioning in antiparallel transport networks,10.1073/pnas.1900416116
1988,Myosin Orientation in a Muscle Fiber Determined with High Angular Resolution Using Bifunctional Spin Labels,10.1085/jgp.201812210
1990,Multiple splitting of droplets using multi-furcating microfluidic channels,10.1063/1.5086716
1991,Dissecting the energetics of subunit rotation in the ribosome,10.1021/acs.jpcb.9b00178
1992,Myosin Orientation in a Muscle Fiber Determined with High Angular Resolution Using Bifunctional Spin Labels,10.1085/jgp.201812210
1994,Single-molecule live-cell imaging reveals parallel pathways of prokaryotic nucleotide excision repair,10.1038/s41467-020-15179-y
1995,Middle-way flexible docking: Pose prediction using mixed-resolution Monte Carlo in estrogen receptor α,10.1371/journal.pone.0215694
1996,The material properties of naked mole-rat hyaluronan,10.1038/s41598-019-43194-7
1997,Expanding the watch list for potential Ebola virus antibody escape mutations,10.1371/journal.pone.0211093
1998,Structural basis for selective stalling of human ribosome nascent chain complexes by a drug-like molecule,10.1038/s41594-019-0236-8
2003,Expanding the watch list for potential Ebola virus antibody escape mutations,10.1371/journal.pone.0211093
2004,Effects of α-tubulin acetylation on microtubule structure and stability,10.1073/pnas.1900441116
2007,Controlling Organization and Forces in Active Matter Through Optically-Defined Boundaries,10.1038/s41586-019-1447-1
2008,Characterizing and inferring epistasis via direct evolutionary couplings in models of allostery,10.1371/journal.pcbi.1007630
2011,Kinesin-5 promotes microtubule nucleation and assembly by stabilizing a lattice-competent conformation of tubulin,10.1016/j.cub.2019.05.075
2014,Analytical expressions and physical principles for single-cell mRNA distributions of the lac operon of Escherichia coli,10.1016/j.bpj.2019.06.029
2015,Geometric control of frequency modulation of cAMP oscillations due to Ca2+-bursts in dendritic spines,10.1016/j.bpj.2019.10.004
2016,ICA512 RESP18 homology domain is a protein condensing factor and insulin fibrillation inhibitor,10.1074/jbc.ra119.007607
2018,Molecular noise of innate immunity shapes bacteria-phage ecologies,10.1371/journal.pcbi.1007168
2019,Molecular mechanism of TRPV2 channel modulation by cannabidiol,10.7554/eLife.48792
2021,Dynamic Change of Electrostatic Field in TMEM16F Permeation Pathway Shifts Its Ion Selectivity,10.7554/elife.45187
2022,Molecular recognition of M1-linked ubiquitin chains by native and phosphorylated UBAN domains,10.1016/j.jmb.2019.06.012
2024,Direct Coupling Analysis of Epistasis in Allosteric Materials,10.1371/journal.pcbi.1007630
2026,The HCN Channel Voltage Sensor Undergoes A Large Downward Motion During Hyperpolarization,10.1038/s41594-019-0259-1
2027,Computational modeling reveals frequency modulation of calcium-cAMP/PKA pathway in dendritic spines,10.1016/j.bpj.2019.10.003
2028,The GRASP domain in Golgi Reassembly and Stacking Proteins: differences and similarities between lower and higher Eukaryotes,10.1111/febs.14869
2029,RPA phosphorylation regulates DNA resection,10.1016/j.molcel.2019.05.005
2030,An integrated microfluidic platform for quantifying drug permeation across biomimetic vesicle membranes,10.1021/acs.molpharmaceut.9b00086
2033,Organization and Regulation of Chromatin by Liquid-Liquid Phase Separation,10.1016/j.cell.2019.08.037
2034,Nanoscopic Stoichiometry and Single-Molecule Counting,10.1002/smtd.201900082
2035,The statistics of noisy growth with mechanical feedback in elastic tissues,10.1073/pnas.1816100116
2038,Modeling enamel matrix secretion in mammalian teeth,10.1371/journal.pcbi.1007058
2039,Stoichiometric quantification of spatially dense assemblies with qPAINT,10.1039/C9NR00472F
2041,ICA512 RESP18 homology domain is a protein condensing factor and insulin fibrillation inhibitor,10.1074/jbc.ra119.007607
2042,"MYOSIN VA TRANSPORT OF LIPOSOMES IN THREE-DIMENSIONAL ACTIN NETWORKS IS MODULATED BY ACTIN FILAMENT DENSITY, POSITION, AND POLARITY",10.1073/pnas.1901176116
2044,Folding landscape of a parallel G-quadruplex,10.1021/acs.jpclett.9b00227
2046,Linking lineage and population observables in biological branching processes,10.1103/PhysRevE.99.042413
2047,"Mechanical and thermodynamic properties of Aβ42, Aβ40 and α-synuclein fibrils: A coarse-grained method to complement experimental studies",10.3762/bjnano.10.51
2048,Emergence of metabolic landscapes in yeast monolayer colonies,10.7554/eLife.47951
2051,A flow extension tethered particle motion assay for single-molecule proteolysis,10.1021/acs.biochem.9b00106
2052,CHAP: a versatile tool for the structural and functional annotation of ion channel pores,10.1016/j.jmb.2019.06.003
2053,Role of Disulfide Bonds and Topological Frustration in the Kinetic Partitioning of Lysozyme Folding Pathways,10.1021/acs.jpcb.9b00739
2055,Empirical and Computational Comparison of Alternative Therapeutic Exon Skip Repairs for Duchenne Muscular Dystrophy,10.1021/acs.biochem.9b00062
2056,A simple linearization method unveils hidden enzymatic assay interferences,10.1016/j.bpc.2019.106193
2057,A Matched-filter Based Algorithm for Subcellular Classification of T-system in Cardiac Tissues,10.1016/j.bpj.2019.03.010
2058,Mechanical feedback enables catch bonds to selectively stabilize scanning microvilli at T-cell surfaces,10.1091/mbc.e19-01-0048
2059,FISIK: Framework for the Inference of in Situ Interaction Kinetics from single-molecule imaging data,10.1016/j.bpj.2019.07.050
2060,Empirical and Computational Comparison of Alternative Therapeutic Exon Skip Repairs for Duchenne Muscular Dystrophy,10.1021/acs.biochem.9b00062
2061,Structural Determinants of Coiled Coil Mechanics,10.1039/c9cp00665f
2062,Bayesian Multiple Emitter Fitting using Reversible Jump Markov Chain Monte Carlo,10.1038/s41598-019-50232-x
2065,"Available energy fluxes drive a transition in the diversity, stability, and functional structure of microbial communities",10.1371/journal.pcbi.1006793
2068,Molecular Dynamics Simulations of the Interaction of Mouse and Torpedo Acetylcholinesterase with Covalent Inhibitors Explain Their Differential Reactivity: Implications for Drug Design,10.1016/j.cbi.2019.06.028
2070,DeepTRIAGE: Interpretable and Individualised BiomarkerScores using Attention Mechanism for the Classification of Breast Cancer Sub-types,10.1186/s12920-020-0658-5
2072,Structural basis for the recognition of K48-linked Ub chain by proteasomal receptor Rpn13,10.1038/s41421-019-0089-7
2073,High-speed device synchronization in optical microscopy with an open-source hardware control platform,10.1038/s41598-019-48455-z
2077,3D Ultrastructure of the Cochlear Outer Hair Cell Lateral Wall Revealed By Electron Tomography,10.3389/fncel.2019.00560
2078,Neuropathy-related mutations alter the membrane binding properties of the human myelin protein P0 cytoplasmic tail,10.1371/journal.pone.0216833
2079,The Metabolites NADP+ and NADPH are the Targets of the Circadian Protein Nocturnin (Curled),10.1038/s41467-019-10125-z
2080,Energy Landscape of the Domain Movement in Staphylococcus aureus UDP-N-acetylglucosamine 2-epimerase,10.1016/j.jsb.2019.05.004
2081,Argonaute bypasses cellular obstacles without hindrance during target search,10.1038/s41467-019-12415-y
2082,Long-term Brillouin imaging of live cells with reduced absorption-mediated damage at 660nm wavelength,10.1364/boe.10.001567
2083,Neuropathy-related mutations alter the membrane binding properties of the human myelin protein P0 cytoplasmic tail,10.1371/journal.pone.0216833
2085,Hydrogen Bond Donors and Acceptors are Generally Depolarizedin α-Helices as Revealed by a Molecular Tailoring Approach,10.1002/jcc.25859
2086,Conformational and dynamical plasticity in substrate-binding proteins underlies selective transport in ABC importers,10.7554/eLife.44652
2087,Hydrogen Bond Donors and Acceptors are Generally Depolarized in α-Helices as Revealed by a Molecular Tailoring Approach,10.1002/jcc.25859
2088,Hydrogen Bond Donors and Acceptors are Generally Depolarized in α-Helices as Revealed by a Molecular Tailoring Approach,10.1002/jcc.25859
2089,The phage L capsid decoration protein has a novel OB-fold and an unusual capsid binding strategy,10.7554/eLife.45345
2090,Functional intra-operative guidance of the cavernous nerve network using near-infrared cyanine voltage-sensitive dye imaging: relevance for nerve-sparing radical prostatectomy,10.1038/s41598-020-63588-2
2091,Synaptotagmin-1 and Doc2b exhibit distinct membrane remodeling mechanisms,10.1016/j.bpj.2019.12.021
2092,Effect of Adhesion and Substrate Elasticity on Neutrophil Extracellular Trap Formation,10.3389/fimmu.2019.02320
2093,Structure-based methyl resonance assignment with MethylFLYA,10.1038/s41467-019-12837-8
2095,"Continuous, Topologically Guided Protein Crystallization Controls Bacterial Surface Layer Self-Assembly",10.1038/s41467-019-10650-x
2096,First Crystal Structure of a Non-Structural Hepatitis E Viral Protein Identifies a Putative Novel Zinc-Binding Protein,10.1128/JVI.00170-19
2097,Hydrogen Bond Donors and Acceptors are Generally Depolarized in α-Helices as Revealed by a Molecular Tailoring Approach,10.1002/jcc.25859
2098,Modeling enamel matrix secretion in mammalian teeth,10.1371/journal.pcbi.1007058
2099,Mechanism of electroneutral sodium/proton antiporter from transition-path shooting,10.1038/s41467-019-09739-0
2101,A Brownian ratchet model explains the biased sidestepping movement of single-headed kinesin-3 KIF1A,10.1016/j.bpj.2019.05.011
2104,Simultaneous tracking of cell motility in liquid and at the solid-liquid interface,10.1128/mSystems.00390-19
2105,DLITE: Dynamic Local Intercellular Tension Estimation,10.1016/j.bpj.2019.09.034
2106,Interactions of nuclear transport factors and surface-conjugated FG nucleoporins: Insights and limitations,10.1371/journal.pone.0217897
2108,Multiscale model of integrin adhesion assembly,10.1371/journal.pcbi.1007077
2109,A semi-automatic dispenser for solid and liquid food in aquatic facilities,10.1089/zeb.2019.1733
2111,Asymmetric Tug-of-War leads to Cooperative Transport of a Cargo by Multiple Kinesins,10.7554/eLife.50974
2112,Symmetry transitions during gating of the TRPV2 ion channel in lipid membranes,10.7554/eLife.45779
2113,A unified rheological model for cells and cellularised materials,10.1098/rsos.190920
2115,Chasing the full free energy landscape of neuroreceptor/ligand unbinding by metadynamics simulations,10.1021/acs.jctc.9b00118
2118,Dynamical model of the CLC-2 ion channel exhibits a two-step gating mechanism,10.1371/journal.pcbi.1007530
2119,BEES: Bayesian Ensemble Estimation from SAS,10.1016/j.bpj.2019.06.024
2120,"Sequence effects on size, shape, and structural heterogeneity in Intrinsically Disordered Proteins",10.1021/acs.jpcb.9b02575
2124,The kinetics of nucleotide binding to isolated Chlamydomonas axonemes using UV-TIRF microscopy,10.1016/j.bpj.2019.07.004
2126,Combining 3D single molecule localization strategies for reproducible bioimaging,10.1038/s41467-019-09901-8
2128,Activation mechanism of ATP-sensitive K+ channels explored with real-time nucleotide binding,10.7554/elife.41103
2130,Dynamics of living cells in a cytomorphological state space,10.1073/pnas.1902849116
2131,Bridging the gap between single cell migration and collective dynamics,10.7554/eLife.46842
2134,Chiroptical Kirigami Modulators for Terahertz Circular Dichroism Spectroscopy of Biomaterials,10.1038/s41563-019-0404-6
2135,Dynamic Aha1 Co-Chaperone Binding to Human Hsp90,10.1002/pro.3678
2136,Dynamics of living cells in a cytomorphological state space,10.1073/pnas.1902849116
2137,Ion Condensation onto Ribozyme is Site-Specific and Fold-Dependent,10.1016/j.bpj.2019.04.037
2139,Structure of the SARS-CoV NSP12 polymerase bound to NSP7 and NSP8 co-factors,10.1038/s41467-019-10280-3
2141,Bridging the gap between single cell migration and collective dynamics,10.7554/eLife.46842
2143,Dynamic clustering regulates activity of mechanosensitive membrane channels,10.1103/PhysRevLett.124.048102
2145,Local-to-global signal transduction at the core of the Mn2+ sensing riboswitch,10.1038/s41467-019-12230-5
2146,A Heuristic Derived from Analysis of the Ion Channel Structural Proteome Permits the Rapid Identification of Hydrophobic Gates,10.1073/pnas.1902702116
2150,Varying crosslinking motifs drive the mesoscale mechanics of actin-microtubule composites,10.1038/s41598-019-49236-4
2151,Computational tool to study perturbations in muscle regulation and its application to heart disease,10.1016/j.bpj.2019.05.002
2152,Computational tool to study perturbations in muscle regulation and its application to heart disease,10.1016/j.bpj.2019.05.002
2154,Computational tool to study perturbations in muscle regulation and its application to heart disease,10.1016/j.bpj.2019.05.002
2155,The allosteric mechanism of substrate-specific transport in SLC6 is mediated by a volumetric sensor,10.1073/pnas.1903020116
2157,3D computational models explain muscle activation patterns and energetic functions of internal structures in fish swimming,10.1371/journal.pcbi.1006883
2158,Myosin Orientation in a Muscle Fiber Determined with High Angular Resolution Using Bifunctional Spin Labels,10.1085/jgp.201812210
2159,Depth-dependent PSF calibration and aberration correction for 3D single-molecule localization,10.1364/boe.10.002708
2160,Disrupted mechanobiology links the molecular and cellular phenotypes in familial dilated cardiomyopathy,10.1073/pnas.1910962116
2161,Structural Insights into Hearing Loss Genetics from Polarizable Protein Repacking,10.1016/j.bpj.2019.06.030
2162,Microfluidic protein isolation and sample preparation for high resolution cryo-EM,10.1073/pnas.1907214116
2164,"HIV-1 Gag specifically restricts PI(4,5)P2 and cholesterol mobility in living cells creating a nanodomain platform for virus assembly.",10.1126/sciadv.aaw8651
